{
  "schema_version": "0.1.0",
  "titulo": "Ciclo XVI — Eldroth sob Sylara: ocupação e vida cotidiana",
  "estado": "hipoteses_de_worldbuilding_pendentes_de_revisao",
  "aprovacao_autoral": false,
  "aplicar_ao_canon_automaticamente": false,
  "regiao_id": "regiao:eldroth",
  "lugar_id": "lugar:eldroth",
  "fonte_principal": "fontes/autoria/hack-carcaca-dw-capitulo-i.paginas.json",
  "passado_referenciado": "data/worldbuilding/eldroth-preconquista-ciclo15.json",
  "atlas_referenciado": "data/worldbuilding/eldroth-ironwood-vandar-ciclo14.json",
  "fatos_documentados": [
    {
      "pagina": 5,
      "afirmacao_no_manuscrito": "Lady Sylara governa Eldroth como estrategista da Rainha da Noite e utiliza criaturas para vigiar e perseguir.",
      "estatuto": "referencia_de_rascunho_nao_promovida"
    },
    {
      "pagina": 17,
      "afirmacao_no_manuscrito": "Círculos druidas foram rompidos, dispersos, ocultados ou cooptados; parte da população fugiu.",
      "estatuto": "referencia_de_rascunho_nao_promovida"
    },
    {
      "pagina": 16,
      "afirmacao_no_manuscrito": "Feéricos não possuem lealdade uniforme à Corte; muitos são dissidentes.",
      "estatuto": "referencia_de_rascunho_nao_promovida"
    },
    {
      "pagina": 7,
      "afirmacao_no_manuscrito": "O controle colonial de rotas, tributos e informações varia conforme a região.",
      "estatuto": "referencia_de_rascunho_nao_promovida"
    },
    {
      "pagina": 9,
      "afirmacao_no_manuscrito": "As guerras de conquista iniciaram em 875 EC; a tomada específica de Eldroth não foi datada.",
      "estatuto": "referencia_de_rascunho_nao_promovida"
    }
  ],
  "limites_editoriais": [
    "Não declarar decreto, imposto, fiscal, tribunal, censo ou órgão da administração de Sylara como fato sem fonte.",
    "Não inventar data de ascensão de Sylara nem desfecho local da conquista.",
    "O uso de criaturas na vigilância não torna toda fauna colaboradora voluntária.",
    "Coação, adesão, sobrevivência e resistência não são posições determinadas por raça.",
    "Não inventar povoado, rota, família, população ou evento de campanha como fato.",
    "Ironwood não é parte de Eldroth; Vandar continua associada a Damaris.",
    "Nenhuma hipótese, vinheta ou escolha autoral é incorporada à cronologia.",
    "Não alterar fichas de criaturas ou regras Dungeon World."
  ],
  "resumo": {
    "mecanismos": 8,
    "posicoes_sociais": 6,
    "modelos_de_regime": 3,
    "dilemas": 4,
    "vinhetas": 4,
    "politicas_confirmadas": 0
  },
  "mecanismos": [
    {
      "id": "worldbuilding-xvi:mecanismo:agua-licenciada",
      "nome_editorial": "A nascente que exige licença",
      "pratica_xv_id": "worldbuilding-xv:pratica:roda-das-nascentes",
      "dominio": "agua_e_trabalho",
      "estado": "hipotese_institucional_nao_confirmada",
      "conversao_proposta": "Mediar a água vira hipótese de autorização revogável por um ocupante.",
      "consequencia_material_proposta": "Quem limpava a nascente poderia precisar de permissão para beber.",
      "discurso_legitimador_possivel": "O controle se diz proteção da água.",
      "pergunta_conflitiva": "Quem pode negar acesso a quem cuidava do recurso?",
      "agencia_local_possivel": "Pessoas afetadas podem buscar testemunhos, avaliar a necessidade coletiva e contestar falsas pretensões de autoridade sem expor abrigos.",
      "fontes_contextuais": [
        {
          "pagina": 17,
          "afirmacao_no_manuscrito": "Prática e costumes das comunidades da floresta.",
          "estatuto": "referencia_de_rascunho_nao_promovida"
        },
        {
          "pagina": 5,
          "afirmacao_no_manuscrito": "Poder feérico ou contexto de ocupação.",
          "estatuto": "referencia_de_rascunho_nao_promovida"
        }
      ],
      "politica_sylara_confirmada": false,
      "ocorreu": false,
      "orgao_administrativo_confirmado": null,
      "quantidade_confirmada": null
    },
    {
      "id": "worldbuilding-xvi:mecanismo:caca-interditada",
      "nome_editorial": "A caça que vira delito",
      "pratica_xv_id": "worldbuilding-xv:pratica:tempo-da-caca",
      "dominio": "alimento",
      "estado": "hipotese_institucional_nao_confirmada",
      "conversao_proposta": "Fechamentos ecológicos podem ser reapresentados como embargos impostos.",
      "consequencia_material_proposta": "Famílias enfrentariam escassez sem decidir sobre caça.",
      "discurso_legitimador_possivel": "O embargo se diz conservação.",
      "pergunta_conflitiva": "A interdição vale mesmo quando não deixa comida?",
      "agencia_local_possivel": "Pessoas afetadas podem buscar testemunhos, avaliar a necessidade coletiva e contestar falsas pretensões de autoridade sem expor abrigos.",
      "fontes_contextuais": [
        {
          "pagina": 17,
          "afirmacao_no_manuscrito": "Prática e costumes das comunidades da floresta.",
          "estatuto": "referencia_de_rascunho_nao_promovida"
        },
        {
          "pagina": 7,
          "afirmacao_no_manuscrito": "Poder feérico ou contexto de ocupação.",
          "estatuto": "referencia_de_rascunho_nao_promovida"
        }
      ],
      "politica_sylara_confirmada": false,
      "ocorreu": false,
      "orgao_administrativo_confirmado": null,
      "quantidade_confirmada": null
    },
    {
      "id": "worldbuilding-xvi:mecanismo:despejo-sagrado",
      "nome_editorial": "O sagrado que despeja",
      "pratica_xv_id": "worldbuilding-xv:pratica:lugar-que-nao-se-edifica",
      "dominio": "terra_e_moradia",
      "estado": "hipotese_institucional_nao_confirmada",
      "conversao_proposta": "Uma proibição cultural de construir pode ser usada para deslocar moradores.",
      "consequencia_material_proposta": "Pessoas perderiam casa sem assegurar a integridade do lugar.",
      "discurso_legitimador_possivel": "O despejo se diz reverência antiga.",
      "pergunta_conflitiva": "Quem comprova o motivo original de um interdito?",
      "agencia_local_possivel": "Pessoas afetadas podem buscar testemunhos, avaliar a necessidade coletiva e contestar falsas pretensões de autoridade sem expor abrigos.",
      "fontes_contextuais": [
        {
          "pagina": 17,
          "afirmacao_no_manuscrito": "Prática e costumes das comunidades da floresta.",
          "estatuto": "referencia_de_rascunho_nao_promovida"
        },
        {
          "pagina": 5,
          "afirmacao_no_manuscrito": "Poder feérico ou contexto de ocupação.",
          "estatuto": "referencia_de_rascunho_nao_promovida"
        }
      ],
      "politica_sylara_confirmada": false,
      "ocorreu": false,
      "orgao_administrativo_confirmado": null,
      "quantidade_confirmada": null
    },
    {
      "id": "worldbuilding-xvi:mecanismo:trilha-denunciada",
      "nome_editorial": "A trilha usada como acusação",
      "pratica_xv_id": "worldbuilding-xv:pratica:memoria-dos-caminhos",
      "dominio": "informacao",
      "estado": "hipotese_institucional_nao_confirmada",
      "conversao_proposta": "Memórias locais de caminhos podem ser exigidas como informações militares.",
      "consequencia_material_proposta": "Guias podem ser suspeitos apenas porque lembram uma estrada.",
      "discurso_legitimador_possivel": "O registro se diz segurança.",
      "pergunta_conflitiva": "A pessoa coagida a falar responde pela perseguição posterior?",
      "agencia_local_possivel": "Pessoas afetadas podem buscar testemunhos, avaliar a necessidade coletiva e contestar falsas pretensões de autoridade sem expor abrigos.",
      "fontes_contextuais": [
        {
          "pagina": 17,
          "afirmacao_no_manuscrito": "Prática e costumes das comunidades da floresta.",
          "estatuto": "referencia_de_rascunho_nao_promovida"
        },
        {
          "pagina": 5,
          "afirmacao_no_manuscrito": "Poder feérico ou contexto de ocupação.",
          "estatuto": "referencia_de_rascunho_nao_promovida"
        }
      ],
      "politica_sylara_confirmada": false,
      "ocorreu": false,
      "orgao_administrativo_confirmado": null,
      "quantidade_confirmada": null
    },
    {
      "id": "worldbuilding-xvi:mecanismo:hospitalidade-vigiada",
      "nome_editorial": "O hóspede que precisa ser denunciado",
      "pratica_xv_id": "worldbuilding-xv:pratica:mesa-da-hospitalidade",
      "dominio": "refugio",
      "estado": "hipotese_institucional_nao_confirmada",
      "conversao_proposta": "Acolhimento tradicional pode ser tratado como dever de informar hóspedes.",
      "consequencia_material_proposta": "Famílias poderiam recusar abrigo por temer revelar nomes.",
      "discurso_legitimador_possivel": "A lista se diz proteção de quem mora ali.",
      "pergunta_conflitiva": "Quem protege o hóspede quando toda hospitalidade é denunciável?",
      "agencia_local_possivel": "Pessoas afetadas podem buscar testemunhos, avaliar a necessidade coletiva e contestar falsas pretensões de autoridade sem expor abrigos.",
      "fontes_contextuais": [
        {
          "pagina": 16,
          "afirmacao_no_manuscrito": "Prática e costumes das comunidades da floresta.",
          "estatuto": "referencia_de_rascunho_nao_promovida"
        },
        {
          "pagina": 17,
          "afirmacao_no_manuscrito": "Poder feérico ou contexto de ocupação.",
          "estatuto": "referencia_de_rascunho_nao_promovida"
        }
      ],
      "politica_sylara_confirmada": false,
      "ocorreu": false,
      "orgao_administrativo_confirmado": null,
      "quantidade_confirmada": null
    },
    {
      "id": "worldbuilding-xvi:mecanismo:promessa-cobrada",
      "nome_editorial": "O pacto que vira dívida",
      "pratica_xv_id": "worldbuilding-xv:pratica:promessa-e-lugar",
      "dominio": "juramentos",
      "estado": "hipotese_institucional_nao_confirmada",
      "conversao_proposta": "Ocupantes podem reclamar para si promessas antigas feitas ao bosque.",